{
  "case_id": "HHG-002",
  "case": {
    "status": "open",
    "verdict": "uncertain",
    "fraud_probability": 0.45,
    "pattern": "none",
    "pattern_description": "",
    "affected_txn_ids": [
      "3478782"
    ],
    "first_suspicious_txn_id": "3478782",
    "connected_card_ids": [],
    "connected_device_profiles": [],
    "exposure_usd": 292.36,
    "evidence": [
      {
        "claim": "Flagged 3478782: $292.36 online, region none, 2016-11-22 17:27:07, no device record; bank risk score 0.79 used only as an input.",
        "source": "graph",
        "ref": "Q01-seed_context",
        "entity_ids": [
          "3478782",
          "C11891-K1"
        ]
      },
      {
        "claim": "Model alerts like this one (score 0.79) are usually cleared: 0 of 900 model-scored closed cases in organizer history were confirmed fraud. This is a prior, not proof.",
        "source": "customer",
        "ref": "trigger:case_pack",
        "entity_ids": [
          "3478782"
        ]
      },
      {
        "claim": "1 prior closed cases on C11891-K1; confirmed patterns: card_not_present_fraud. No prior confirmed fraud transaction was billed in region null (prior fraud regions: none).",
        "source": "graph",
        "ref": "Q06-historical_cases",
        "entity_ids": [
          "CC-4160"
        ]
      },
      {
        "claim": "No other customer shares region null and email domain hotmail.com in the 48h window, and no other customer's fraud case links to this card.",
        "source": "graph",
        "ref": "Q07-shared_origin",
        "entity_ids": [
          "3478782"
        ]
      }
    ],
    "similar_prior_cases": [
      "CC-4160"
    ],
    "summary": "The bank model scored 3478782 ($292.36 online) at 0.79 for C11891. Against: Model alerts like this one (score 0.79) are usually cleared: 0 of 900 model-scored closed cases in organizer history were confirmed fraud. The evidence leans legitimate but is not strong enough to clear the alert, so the verdict is uncertain at 0.45. The customer is asked to confirm.",
    "written_to_graph": false,
    "graph_case_id": ""
  },
  "evidence_requests": [
    {
      "type": "customer_validation",
      "asked_after_step": 7,
      "assumed_response": "Do you still have the card, and do you recognise the other recent purchases? Assumed: No reply within 24 hours. Fixed simulator default applied to every customer request in this build; it is not chosen per case and carries no hidden label."
    }
  ],
  "next_best_actions": {
    "initial": [
      {
        "action": "VERIFY_WITH_CUSTOMER",
        "route": "auto",
        "reason": "R1: dataset policy obligation"
      }
    ],
    "final": [
      {
        "action": "VERIFY_WITH_CUSTOMER",
        "route": "auto",
        "reason": "R1: dataset policy obligation"
      },
      {
        "action": "MONITOR_CARD",
        "route": "auto",
        "reason": "R4: no customer reply within 24 hours (simulated)"
      }
    ],
    "what_changed": "The customer was asked (REQ-1); the fixed simulator assumed no reply within 24 hours, so R4 adds MONITOR_CARD. No DECLINE_TRANSACTION because pending-authorization status is not in the data (D05); exposure $292.36 is under the R4 $500 escalation threshold."
  },
  "sar": {
    "file": false,
    "reason": "No FILE_REPORT: exposure $292.36 is under $1,000, no shared device, region cluster or other customer's fraud was found, and fraud is not confirmed or strongly suspected (R2, section 3a).",
    "narrative": "",
    "subjects": [],
    "total_amount_usd": 0,
    "activity_dates": []
  },
  "stop_reason": "Further graph steps are unlikely to change the decision.",
  "tool_calls": 7,
  "tokens": 0,
  "latency_s": 0.012
}
