{
  "case_id": "HHG-009",
  "case": {
    "status": "open",
    "verdict": "uncertain",
    "fraud_probability": 0.65,
    "pattern": "none",
    "pattern_description": "",
    "affected_txn_ids": [
      "3581141"
    ],
    "first_suspicious_txn_id": "3581141",
    "connected_card_ids": [],
    "connected_device_profiles": [],
    "exposure_usd": 30.02,
    "evidence": [
      {
        "claim": "Flagged 3581141: $30.02 online, region 203, 2016-12-28 12:10:53, no device record; bank risk score 0.28 used only as an input.",
        "source": "graph",
        "ref": "Q01-seed_context",
        "entity_ids": [
          "3581141",
          "C08299-K1"
        ]
      },
      {
        "claim": "Customer C08299 denies 3581141. In organizer history, 4656 of 4656 cardholder-reported closed cases were confirmed fraud (history only contains closed outcomes, so this is a prior, not proof).",
        "source": "customer",
        "ref": "trigger:case_pack",
        "entity_ids": [
          "3581141",
          "C08299"
        ]
      },
      {
        "claim": "No other customer shares region 203 and email domain null in the 48h window, and no other customer's fraud case links to this card.",
        "source": "graph",
        "ref": "Q07-shared_origin",
        "entity_ids": [
          "3581141"
        ]
      }
    ],
    "similar_prior_cases": [],
    "summary": "C08299 disputes 3581141, a $30.02 online purchase in billing region 203. For fraud: Customer C08299 denies 3581141. The evidence leans toward fraud but is not strong enough to confirm it, so the verdict is uncertain at 0.65. The card block is recommended under R2 and waits for L1 approval.",
    "written_to_graph": false,
    "graph_case_id": ""
  },
  "evidence_requests": [
    {
      "type": "customer_validation",
      "asked_after_step": 7,
      "assumed_response": "Do you still have the card, and do you recognise the other recent purchases? Assumed: No reply within 24 hours. Fixed simulator default applied to every customer request in this build; it is not chosen per case and carries no hidden label."
    }
  ],
  "next_best_actions": {
    "initial": [
      {
        "action": "CREATE_CASE",
        "route": "auto",
        "reason": "R2 and section 3a: customer disputes a charge"
      },
      {
        "action": "VERIFY_WITH_CUSTOMER",
        "route": "auto",
        "reason": "Policy section 5 and R8: evidence conflicts; ask the customer: Do you still have the card, and do you recognise the other recent purchases?"
      },
      {
        "action": "BLOCK_CARD",
        "route": "L1",
        "reason": "R2: customer denied the transaction; exposure $30.02 is at most $2,500, so L1 approval"
      }
    ],
    "final": [
      {
        "action": "CREATE_CASE",
        "route": "auto",
        "reason": "R2 and section 3a: customer disputes a charge"
      },
      {
        "action": "MONITOR_CARD",
        "route": "auto",
        "reason": "R4: no customer reply within 24 hours (simulated)"
      },
      {
        "action": "BLOCK_CARD",
        "route": "L1",
        "reason": "R2: customer denied the transaction; exposure $30.02 is at most $2,500, so L1 approval"
      }
    ],
    "what_changed": "The customer was asked (REQ-1); the fixed simulator assumed no reply within 24 hours, so R4 adds MONITOR_CARD. No DECLINE_TRANSACTION because pending-authorization status is not in the data (D05); exposure $30.02 is under the R4 $500 escalation threshold."
  },
  "sar": {
    "file": false,
    "reason": "No FILE_REPORT: exposure $30.02 is under $1,000, no shared device, region cluster or other customer's fraud was found, and fraud is not confirmed or strongly suspected (R2, section 3a).",
    "narrative": "",
    "subjects": [],
    "total_amount_usd": 0,
    "activity_dates": []
  },
  "stop_reason": "Further graph steps are unlikely to change the decision.",
  "tool_calls": 7,
  "tokens": 9901,
  "latency_s": 0.01
}
