{
  "case_id": "HHG-006",
  "case": {
    "status": "escalated",
    "verdict": "uncertain",
    "fraud_probability": 0.55,
    "pattern": "none",
    "pattern_description": "",
    "affected_txn_ids": [
      "3476682"
    ],
    "first_suspicious_txn_id": "3476682",
    "connected_card_ids": [],
    "connected_device_profiles": [],
    "exposure_usd": 482.12,
    "evidence": [
      {
        "claim": "Flagged 3476682: $482.12 online, region 264, 2016-11-21 20:30:00, device Trident/7.0|Windows 7|ie 11.0 for desktop|1920x1080; bank risk score 0.25 used only as an input.",
        "source": "graph",
        "ref": "Q01-seed_context",
        "entity_ids": [
          "3476682",
          "C07297-K1"
        ]
      },
      {
        "claim": "Customer C07297 denies 3476682. In organizer history, 4656 of 4656 cardholder-reported closed cases were confirmed fraud (history only contains closed outcomes, so this is a prior, not proof).",
        "source": "customer",
        "ref": "trigger:case_pack",
        "entity_ids": [
          "3476682",
          "C07297"
        ]
      },
      {
        "claim": "Region 264 is established for C07297: 28 prior transactions since 2016-07-06 00:29:46. This is not out-of-region use.",
        "source": "graph",
        "ref": "Q02-region_history",
        "entity_ids": [
          "3476682"
        ]
      },
      {
        "claim": "No other customer shares region 264 and email domain gmail.com in the 48h window, and no other customer's fraud case links to this card.",
        "source": "graph",
        "ref": "Q08-shared_origin",
        "entity_ids": [
          "3476682"
        ]
      }
    ],
    "similar_prior_cases": [],
    "summary": "C07297 disputes 3476682, a $482.12 online purchase in billing region 264. For fraud: Customer C07297 denies 3476682. Against: Region 264 is established for C07297: 28 prior transactions since 2016-07-06 00:29:46. Evidence conflicts, so the verdict is uncertain at 0.55. The card block is recommended under R2 and waits for L1 approval; the case is escalated under R8.",
    "written_to_graph": false,
    "graph_case_id": ""
  },
  "evidence_requests": [
    {
      "type": "customer_validation",
      "asked_after_step": 8,
      "assumed_response": "Did you make 3476602 ($478.95 at 20:00), 3477578 ($82.97 at 02:07) on 2016-11-21, and do you still have the card? Assumed: No reply within 24 hours. Fixed simulator default applied to every customer request in this build; it is not chosen per case and carries no hidden label."
    }
  ],
  "next_best_actions": {
    "initial": [
      {
        "action": "CREATE_CASE",
        "route": "auto",
        "reason": "R2 and section 3a: customer disputes a charge"
      },
      {
        "action": "VERIFY_WITH_CUSTOMER",
        "route": "auto",
        "reason": "Policy section 5 and R8: evidence conflicts; ask the customer: Did you make 3476602 ($478.95 at 20:00), 3477578 ($82.97 at 02:07) on 2016-11-21, and do you still have the card?"
      },
      {
        "action": "BLOCK_CARD",
        "route": "L1",
        "reason": "R2: customer denied the transaction; exposure $482.12 is at most $2,500, so L1 approval"
      },
      {
        "action": "ESCALATE_TO_ANALYST",
        "route": "auto",
        "reason": "R8: verdict uncertain and the evidence conflicts"
      }
    ],
    "final": [
      {
        "action": "CREATE_CASE",
        "route": "auto",
        "reason": "R2 and section 3a: customer disputes a charge"
      },
      {
        "action": "MONITOR_CARD",
        "route": "auto",
        "reason": "R4: no customer reply within 24 hours (simulated)"
      },
      {
        "action": "BLOCK_CARD",
        "route": "L1",
        "reason": "R2: customer denied the transaction; exposure $482.12 is at most $2,500, so L1 approval"
      },
      {
        "action": "ESCALATE_TO_ANALYST",
        "route": "auto",
        "reason": "R8: verdict uncertain and the evidence conflicts"
      }
    ],
    "what_changed": "The customer was asked (REQ-1); the fixed simulator assumed no reply within 24 hours, so R4 adds MONITOR_CARD. No DECLINE_TRANSACTION because pending-authorization status is not in the data (D05); exposure $482.12 is under the R4 $500 escalation threshold."
  },
  "sar": {
    "file": false,
    "reason": "No FILE_REPORT: exposure $482.12 is under $1,000, no shared device, region cluster or other customer's fraud was found, and fraud is not confirmed or strongly suspected (R2, section 3a).",
    "narrative": "",
    "subjects": [],
    "total_amount_usd": 0,
    "activity_dates": []
  },
  "stop_reason": "Further graph steps are unlikely to change the decision: region, amount, email-domain, device, history and shared-origin checks are done and the remaining questions (customer's answer, merchant identity) are not in the data. Escalated to an analyst with the conflict visible (R8).",
  "tool_calls": 8,
  "tokens": 0,
  "latency_s": 0.013
}
